{
  "$schema": "https://json-schema.org/draft/2020-12/schema",
  "$id": "https://probelabs.com/schema/aeo-cli-config-v1.json",
  "title": "aeo-cli-config-v1",
  "type": "object",
  "additionalProperties": false,
  "required": ["brand", "domain", "aliases", "competitors", "engines", "prompts"],
  "properties": {
    "schema_version": {
      "type": "string",
      "const": "aeo-cli-config-v1"
    },
    "brand": { "type": "string", "minLength": 1 },
    "domain": { "type": "string", "minLength": 1 },
    "aliases": {
      "type": "array",
      "items": { "type": "string", "minLength": 1 }
    },
    "measurement_set": {
      "type": "object",
      "required": ["id", "version"],
      "description": "Frozen questions used to measure change. Exploratory prompts are left out of the hash and reported separately.",
      "properties": {
        "id": { "type": "string" },
        "version": { "type": "integer" },
        "frozen": { "type": "string" },
        "question_hash": { "type": "string" },
        "count": { "type": "integer" },
        "note": { "type": "string" }
      }
    },
    "brand_facts": {
      "type": "string",
      "description": "Short factual description of the product; the judge checks 'described accurately' against it."
    },
    "identity_terms": {
      "type": "array",
      "items": { "type": "string" },
      "description": "Extra names, emails or companies the identity canary must never see in an answer."
    },
    "brand_match": {
      "type": "object",
      "additionalProperties": false,
      "properties": {
        "product_form_only": {
          "type": "array",
          "items": { "type": "string", "minLength": 1 },
          "description": "Brand/alias terms that are ordinary words (e.g. Proof). Matched case-sensitively and only in clear product form (Proof (reqproof.com), tools like Proof, Try Proof); never proof / proof of / Proof assistants / glossary or table labels. Omit to use the matcher default (just 'proof')."
        }
      },
      "description": "How the deterministic brand matcher (aeo.mention) treats ambiguous brand names."
    },
    "competitors": {
      "type": "array",
      "items": { "type": "string", "minLength": 1 },
      "description": "Seed / known competitor set (expected category map; not URLs). Keep adding names up front. Deterministic regex uses this list for competitor_mentions and vendors_in_search_queries. Post-run LLM extract still discovers names absent from this list; those are flagged as surprises. Duplicate seeds that are synonyms (Amazon/AWS API Gateway, Azure APIM/Management) collapse to one canonical vendor."
    },
    "competitor_aliases": {
      "type": "object",
      "additionalProperties": {
        "type": "array",
        "items": { "type": "string", "minLength": 1 }
      },
      "description": "Optional canonical name → extra spellings. Prefer one display (e.g. Amazon API Gateway) and list AWS API Gateway / amazon api gateway here. Duplicate seeds still collapse even without this map."
    },
    "engines": {
      "type": "array",
      "minItems": 1,
      "items": { "type": "string", "enum": ["claude", "codex", "grok"] },
      "uniqueItems": true
    },
    "prompts": {
      "type": "array",
      "minItems": 1,
      "items": {
        "type": "object",
        "additionalProperties": false,
        "required": ["id", "text"],
        "properties": {
          "id": { "type": "string", "minLength": 1 },
          "text": { "type": "string", "minLength": 1 },
          "intent": { "type": "string" },
          "class": {
            "type": "string",
            "enum": ["watch", "focus"],
            "description": "watch = keep measuring an incumbent/knowledge trap. focus = search-likely and/or product-fit (AEO work goes here)."
          },
          "why": {
            "type": "string",
            "description": "Short tag, e.g. knowledge_trap, search_likely, product_fit, search_likely+product_fit."
          },
          "enabled": {
            "type": "boolean",
            "default": true,
            "description": "Default true. Never set watch queries to false."
          },
          "group": {
            "type": "string",
            "enum": ["measurement", "exploratory"],
            "description": "exploratory = new or reworded question, reported apart from the frozen measurement set. Default measurement."
          }
        }
      }
    },
    "cli": {
      "type": "object",
      "additionalProperties": false,
      "properties": {
        "claude": { "type": "string", "minLength": 1 },
        "codex": { "type": "string", "minLength": 1 },
        "grok": { "type": "string", "minLength": 1 }
      }
    },
    "data_dir": { "type": "string", "minLength": 1 },
    "samples_per_arm": {
      "type": "integer",
      "minimum": 1,
      "default": 1
    },
    "google_targets": {
      "$ref": "#/$defs/google_search_list",
      "description": "Approved Google searches to win (about 10). Checked on every run with the full analysis: AI Overview text and sources, top 10 organic, our position in the top 100, optional AI Mode. Separate from the LLM board scores."
    },
    "google_watch": {
      "$ref": "#/$defs/google_search_list",
      "description": "Optional wider watch list (any size, e.g. 20-50). Rankings and AI Overview citations only; a lighter table in the report."
    },
    "google": {
      "type": "object",
      "additionalProperties": false,
      "description": "Google layer (DataForSEO). On by default when DataForSEO credentials are set; enabled=false turns it off.",
      "properties": {
        "enabled": { "type": "boolean", "default": true },
        "location_code": { "type": "integer", "default": 2840 },
        "language_code": { "type": "string", "default": "en" },
        "device": { "type": "string", "enum": ["desktop", "mobile"], "default": "desktop" },
        "depth": { "type": "integer", "minimum": 10, "maximum": 100, "default": 100 },
        "watch_depth": { "type": "integer", "minimum": 10, "maximum": 100, "default": 100 },
        "mobile": { "type": "boolean", "default": false, "description": "Extra mobile snapshot for targets" },
        "mobile_depth": { "type": "integer", "minimum": 10, "maximum": 100, "default": 10 },
        "ai_mode": { "type": "boolean", "default": true, "description": "Google AI Mode for targets (about $0.004 per search)" },
        "max_cost_usd": { "type": "number", "minimum": 0, "default": 2.0, "description": "Spending cap per run. Over-cap estimates are skipped before any call." },
        "own_url_patterns": { "type": "array", "items": { "type": "string", "minLength": 1 }, "description": "Extra URL prefixes that count as ours, e.g. github.com/acme/tool" },
        "workers": { "type": "integer", "minimum": 1, "default": 4 },
        "retries": { "type": "integer", "minimum": 1, "default": 3 }
      }
    },
    "gsc": {
      "type": "object",
      "additionalProperties": false,
      "description": "Search Console layer. On by default when GSC credentials are found; enabled=false turns it off.",
      "properties": {
        "enabled": { "type": "boolean", "default": true },
        "site": { "type": "string", "minLength": 1, "description": "GSC property, e.g. sc-domain:acme.example or https://acme.example/. Default sc-domain:<domain>." },
        "window_days": { "type": "integer", "minimum": 1, "default": 28 },
        "lag_days": { "type": "integer", "minimum": 0, "default": 3 },
        "row_limit": { "type": "integer", "minimum": 1, "maximum": 25000, "default": 5000 },
        "top_n": { "type": "integer", "minimum": 1, "default": 25 },
        "min_impressions": { "type": "integer", "minimum": 0, "default": 5 },
        "striking_min_position": { "type": "number", "default": 5 },
        "striking_max_position": { "type": "number", "default": 20 },
        "suggest_limit": { "type": "integer", "minimum": 0, "default": 20 }
      }
    }
  },
  "$defs": {
    "google_search_list": {
      "type": "array",
      "items": {
        "oneOf": [
          { "type": "string", "minLength": 1 },
          {
            "type": "object",
            "additionalProperties": false,
            "required": ["query"],
            "properties": {
              "query": { "type": "string", "minLength": 1 },
              "id": { "type": "string", "minLength": 1 },
              "priority": { "type": "integer", "minimum": 1 },
              "lead": { "type": "string" },
              "page_should_demonstrate": { "type": "string" },
              "notes": { "type": "string" }
            }
          }
        ]
      }
    }
  }
}
