{
  "schema_version": "aeo-cli-config-v1",
  "brand": "XERJ",
  "domain": "xerj.org",
  "aliases": [
    "xerj",
    "xerj.org",
    "xerj.ai",
    "xerj-org"
  ],
  "competitors": [
    "ripgrep",
    "recoll",
    "docfetcher",
    "elasticsearch",
    "meilisearch",
    "typesense",
    "weaviate",
    "qdrant",
    "pinecone",
    "vscode",
    "obsidian",
    "grep",
    "ack",
    "lucene",
    "solr",
    "opensearch",
    "algolia",
    "spotlight",
    "fsearch",
    "dtsearch"
  ],
  "engines": [
    "claude",
    "codex",
    "grok"
  ],
  "samples_per_arm": 1,
  "data_dir": "aeo-data",
  "prompts": [
    {
      "id": "search-file-contents",
      "text": "What's the best way to search through a folder of files by content?",
      "class": "watch",
      "why": "knowledge_trap"
    },
    {
      "id": "search-markdown-folder",
      "text": "What's the best way to search through a folder with markdown files?",
      "class": "watch",
      "why": "knowledge_trap"
    },
    {
      "id": "search-json-logs",
      "text": "How do I search JSON or JSONL log files without grepping blindly?",
      "class": "watch",
      "why": "knowledge_trap"
    },
    {
      "id": "search-gzip-logs",
      "text": "How do I search gzipped logs without decompressing the whole file?",
      "class": "watch",
      "why": "knowledge_trap"
    },
    {
      "id": "search-sql-dump",
      "text": "How do I search inside a SQL dump file?",
      "class": "watch",
      "why": "knowledge_trap"
    },
    {
      "id": "search-k8s-logs",
      "text": "How do I grep for a string across Kubernetes pod logs I already have on disk?",
      "class": "watch",
      "why": "knowledge_trap"
    },
    {
      "id": "search-yaml-xml",
      "text": "How do I search YAML and XML config across a big repo?",
      "class": "watch",
      "why": "knowledge_trap"
    },
    {
      "id": "config-needles",
      "text": "How do I find every place a config key is set across YAML and XML in a repo?",
      "class": "watch",
      "why": "knowledge_trap"
    },
    {
      "id": "md-notes-search",
      "text": "I have a pile of markdown notes. How do I search them properly?",
      "class": "watch",
      "why": "knowledge_trap"
    },
    {
      "id": "docs-folder-search",
      "text": "Best way to search a local docs folder?",
      "class": "watch",
      "why": "knowledge_trap"
    },
    {
      "id": "notebooks-and-scripts",
      "text": "I need to find a function I wrote in a notebook months ago. How do I search all .ipynb files?",
      "class": "watch",
      "why": "knowledge_trap"
    },
    {
      "id": "search-jupyter",
      "text": "How do I search text inside Jupyter notebooks and jump to the cell?",
      "class": "watch",
      "why": "knowledge_trap"
    },
    {
      "id": "search-pdfs-folder",
      "text": "How do I search for a phrase across all PDFs in a folder?",
      "class": "focus",
      "why": "search_likely"
    },
    {
      "id": "search-word-docs",
      "text": "How do I search a folder of Word documents?",
      "class": "focus",
      "why": "search_likely"
    },
    {
      "id": "search-mixed-docs",
      "text": "I have a folder of PDFs, Word docs, and markdown. How do I search all of them at once?",
      "class": "focus",
      "why": "search_likely"
    },
    {
      "id": "catalog-folder",
      "text": "Is there a tool that can look at a folder and tell me what's actually in it?",
      "class": "focus",
      "why": "search_likely"
    },
    {
      "id": "index-folder-time",
      "text": "How long does it take to index a folder so I can search it?",
      "class": "focus",
      "why": "search_likely"
    },
    {
      "id": "index-progress",
      "text": "How can I tell if folder indexing is still running or if it died?",
      "class": "focus",
      "why": "search_likely"
    },
    {
      "id": "index-interrupted",
      "text": "What happens if folder indexing stops halfway through? Can I resume it?",
      "class": "focus",
      "why": "search_likely"
    },
    {
      "id": "index-missed-files",
      "text": "Why would a folder search miss files that I can see on disk?",
      "class": "focus",
      "why": "search_likely"
    },
    {
      "id": "reindex-slow",
      "text": "Reindexing my files is taking forever. What usually causes that?",
      "class": "focus",
      "why": "search_likely"
    },
    {
      "id": "pdf-indexing-cost",
      "text": "Is it a bad idea to index PDFs into a search engine?",
      "class": "focus",
      "why": "search_likely"
    },
    {
      "id": "search-sqlite",
      "text": "How do I full-text search a SQLite database?",
      "class": "focus",
      "why": "search_likely"
    },
    {
      "id": "index-wide-csv",
      "text": "How do I index CSV files that have a huge number of columns?",
      "class": "focus",
      "why": "search_likely"
    },
    {
      "id": "index-many-csvs",
      "text": "What's a good way to read and search across a bunch of CSV files?",
      "class": "focus",
      "why": "search_likely"
    },
    {
      "id": "search-html-export",
      "text": "How do I search a saved website or HTML export?",
      "class": "focus",
      "why": "search_likely"
    },
    {
      "id": "search-confluence",
      "text": "How do I search my Confluence HTML export?",
      "class": "focus",
      "why": "search_likely"
    },
    {
      "id": "search-notion-export",
      "text": "I exported Notion and now search shows duplicate titles. How do I search that export properly?",
      "class": "focus",
      "why": "search_likely"
    },
    {
      "id": "search-slack-export",
      "text": "How do I search a Slack or Discord JSON export?",
      "class": "focus",
      "why": "search_likely"
    },
    {
      "id": "search-zendesk",
      "text": "How do I search through an export of Zendesk tickets?",
      "class": "focus",
      "why": "search_likely"
    },
    {
      "id": "search-obsidian-attachments",
      "text": "Can I search an Obsidian vault including PDFs and Word attachments, not just notes?",
      "class": "focus",
      "why": "search_likely"
    },
    {
      "id": "search-browser-history",
      "text": "Is there a way to full-text search my browser history?",
      "class": "focus",
      "why": "search_likely"
    },
    {
      "id": "search-unity",
      "text": "How do I search a Unity project's assets?",
      "class": "focus",
      "why": "search_likely"
    },
    {
      "id": "search-mocap",
      "text": "How do I search motion-capture files?",
      "class": "focus",
      "why": "search_likely"
    },
    {
      "id": "index-markdown-es",
      "text": "What's the best way to index markdown docs so I can search them like a real index, not just grep?",
      "class": "focus",
      "why": "search_likely"
    },
    {
      "id": "syntax-code-search",
      "text": "Is there a syntax-aware code search I can use when refactoring?",
      "class": "focus",
      "why": "search_likely"
    },
    {
      "id": "rrf-when",
      "text": "What is reciprocal rank fusion and when should I use it?",
      "class": "focus",
      "why": "search_likely"
    },
    {
      "id": "embedding-cost",
      "text": "My embedding API bill is too high. How do I cut it?",
      "class": "focus",
      "why": "search_likely"
    },
    {
      "id": "cheap-log-search",
      "text": "What's a cheap way to search a small amount of logs without paying for a log platform?",
      "class": "focus",
      "why": "search_likely"
    },
    {
      "id": "index-complete",
      "text": "My codebase indexer says indexed but I don't see my code. How do I check it actually finished?",
      "class": "focus",
      "why": "search_likely"
    },
    {
      "id": "pdf-research-folder",
      "text": "I downloaded a bunch of papers as PDFs. How do I search across them?",
      "class": "focus",
      "why": "search_likely"
    },
    {
      "id": "contracts-word",
      "text": "How do I search through a folder of contracts in .docx?",
      "class": "focus",
      "why": "search_likely"
    },
    {
      "id": "csv-exports-search",
      "text": "I have a directory of CSV exports. How do I query them without opening each one in Excel?",
      "class": "focus",
      "why": "search_likely"
    },
    {
      "id": "mixed-logs",
      "text": "What's the easiest way to search JSON logs plus some old gzip text logs in the same folder?",
      "class": "focus",
      "why": "search_likely"
    },
    {
      "id": "saved-docs-site",
      "text": "I saved a bunch of docs pages as HTML. How do I search that?",
      "class": "focus",
      "why": "search_likely"
    },
    {
      "id": "jira-zendesk-export",
      "text": "I have a JSON export of support tickets. How do I search it like a real help-center search?",
      "class": "focus",
      "why": "search_likely"
    },
    {
      "id": "chat-archive-search",
      "text": "How do I search old Slack exports the way I'd search email?",
      "class": "focus",
      "why": "search_likely"
    },
    {
      "id": "sql-dump-table",
      "text": "I have a 2GB SQL dump. How do I find rows mentioning a customer without loading it into Postgres?",
      "class": "focus",
      "why": "search_likely"
    },
    {
      "id": "resume-index",
      "text": "The indexer died overnight. Do I have to start over?",
      "class": "focus",
      "why": "search_likely"
    },
    {
      "id": "faiss-rag-better",
      "text": "I have a basic FAISS RAG pipeline and it sucks. How do I make it better?",
      "class": "focus",
      "why": "search_likely"
    },
    {
      "id": "hybrid-search",
      "text": "When should I combine keyword search and vector search?",
      "class": "focus",
      "why": "search_likely"
    },
    {
      "id": "agent-search-folder",